French,Russian,WordType,ExampleFrench,ExampleRussian,Notes,Emoji,Source
un couraillage,беготня,m,"Avec ce <b>couraillage</b> je suis épuisé.","От этой <b>беготни</b> я измотан.",De courailler = courir partout.,🏃,quebecismes
courailleur; courailleuse,бегающий повсюду,adj,"Ce chien est trop <b>courailleur</b> pour un appartement.","Эта собака слишком <b>непоседливая</b> для квартиры.",Familier. France: qui court partout.,🐕,quebecismes
un coussin,лежачий полицейский,m,"Attention au <b>coussin</b> sur la route !","Осторожно — <b>лежачий полицейский</b> на дороге!",Aussi: dos d'âne. Terme routier OQLF.,🚗,quebecismes
cramper,выкручивать руль,v,"<b>Crampe</b> à gauche pour te stationner.","<b>Выверни руль</b> влево, чтобы припарковаться.",Familier. France: braquer. Groupe 1 (-er).,🔄,quebecismes
un crapet,солнечная рыба,m,"On a pêché des <b>crapets</b> dans le lac.","Мы наловили <b>солнечных рыб</b> в озере.",Poisson coloré d'eau douce. Pêche sportive.,🐠,quebecismes
croche,кривой; нечестный,adj,"Cette affaire me semble <b>croche</b>.","Это дело кажется мне <b>нечестным</b>.",Familier. Aussi: tordu physiquement. Très courant.,📐,quebecismes
crochir,гнуть; искривлять,v,"Le vent a <b>crochi</b> les branches de l'arbre.","Ветер <b>согнул</b> ветки дерева.",France: courber / tordre. Groupe 2 (-ir).,🌬️,quebecismes
un créditiste; une créditiste,кредитист (полит.),m,"Mon grand-père était <b>créditiste</b> dans les années 60.","Мой дедушка был <b>кредитистом</b> в 60-х.",Parti politique historique du Québec. Crédit social.,🏛️,quebecismes
une cuirette,кожзам,f,"Ce sofa est en <b>cuirette</b> pas en vrai cuir.","Этот диван из <b>кожзама</b> а не из настоящей кожи.",France: similicuir / skaï.,🛋️,quebecismes
une cédrière,кедровник,f,"On se promène dans la <b>cédrière</b> derrière la maison.","Мы гуляем в <b>кедровнике</b> за домом.",Thuya occidental (cèdre blanc). Forêt québécoise.,🌲,quebecismes
un cégep,колледж (Квебек),m,"Elle étudie au <b>cégep</b> de Montréal.","Она учится в <b>колледже</b> в Монреале.",Collège d'enseignement général et professionnel. Unique au Québec!,🏫,quebecismes
un cégépien; une cégépienne,студент колледжа,m,"Les <b>cégépiens</b> ont congé demain.","<b>Студенты колледжа</b> завтра отдыхают.",Étudiant de cégep. Système éducatif québécois.,👨‍🎓,quebecismes
une denturologie,зубопротезирование,f,"Il a étudié la <b>denturologie</b> pendant trois ans.","Он изучал <b>зубопротезирование</b> три года.",Profession paramédicale québécoise.,🦷,quebecismes
un denturologiste; une denturologiste,зубной техник,m,"Le <b>denturologiste</b> a ajusté mes prothèses.","<b>Зубной техник</b> подогнал мои протезы.",France: prothésiste dentaire.,😁,quebecismes
un diachylon,пластырь,m,"Mets un <b>diachylon</b> sur ta coupure.","Наклей <b>пластырь</b> на порез.",France: pansement / sparadrap. De marque commerciale.,🩹,quebecismes
disable,невероятный,adj,"C'est pas <b>disable</b> comme c'était bon !","Это <b>невероятно</b> как было вкусно!",Familier. Négatif: n'être pas disable = incroyable.,🤯,quebecismes
un diététiste; une diététiste,диетолог,m,"J'ai consulté un <b>diététiste</b> pour perdre du poids.","Я обратился к <b>диетологу</b> чтобы похудеть.",Terme officiel. France: diététicien.,🥗,quebecismes
une douance,одарённость,f,"Son fils a été diagnostiqué avec une <b>douance</b>.","У его сына диагностировали <b>одарённость</b>.",Terme pédagogique. France: surdouement / haut potentiel.,🧒,quebecismes
un doubleur; une doubleuse,второгодник,m,"Il y a plusieurs <b>doubleurs</b> dans cette classe.","В этом классе несколько <b>второгодников</b>.",France: redoublant.,📚,quebecismes
draver,сплавлять лес,v,"Mon arrière-grand-père <b>dravait</b> sur la rivière Saint-Maurice.","Мой прадед <b>сплавлял лес</b> по реке Сен-Морис.",Métier historique. De l'anglais to drive (logs). Groupe 1 (-er).,🪵,quebecismes
une débarbouillette,махровая салфетка (для умывания),f,"Passe-moi la <b>débarbouillette</b> s'il te plaît.","Передай мне <b>салфетку</b> пожалуйста.",Très courant. France: gant de toilette.,🧼,quebecismes
un débossage,выправление вмятин,m,"Le <b>débossage</b> de ma voiture m'a coûté cher.","<b>Выправление вмятин</b> моей машины обошлось дорого.",Carrosserie automobile. France: débosselage.,🔧,quebecismes
débosser,выправлять вмятины,v,"Il faut <b>débosser</b> l'aile avant de la peindre.","Нужно <b>выправить вмятины</b> на крыле перед покраской.",France: débosseler. Groupe 1 (-er).,🚙,quebecismes
dégêner,раскрепощать,v,"Un verre de vin l'a <b>dégêné</b>.","Бокал вина его <b>раскрепостил</b>.",France: mettre à l'aise. Groupe 1 (-er).,🍷,quebecismes
un dépanneur,магазин шаговой доступности,m,"Je vais au <b>dépanneur</b> chercher du lait.","Иду в <b>магазинчик</b> за молоком.",Très courant! Icône québécoise. France: épicerie de quartier.,🏪,quebecismes
un dépôt forestier,лесная база,m,"Les bûcherons se retrouvent au <b>dépôt forestier</b>.","Лесорубы собираются на <b>лесной базе</b>.",Industrie forestière. Centre d'approvisionnement.,🌲,quebecismes
un désennui,развлечение,m,"La lecture est mon <b>désennui</b> préféré.","Чтение — моё любимое <b>развлечение</b>.",France: distraction / divertissement.,📖,quebecismes
dézoner,менять зонирование,v,"La ville veut <b>dézoner</b> ce terrain agricole.","Город хочет <b>изменить зонирование</b> этого сельхозучастка.",Urbanisme. Politique municipale. Groupe 1 (-er).,🗺️,quebecismes
une efface,ластик,f,"Prête-moi ton <b>efface</b> s'il te plaît.","Одолжи мне свой <b>ластик</b> пожалуйста.",Très courant. France: gomme.,✏️,quebecismes
emboucaner,коптить,v,"On va <b>emboucaner</b> du saumon cette fin de semaine.","Мы будем <b>коптить</b> лосося в эти выходные.",France: fumer / enfumer. Groupe 1 (-er).,🐟,quebecismes
embouveter,соединять в паз,v,"Le menuisier <b>embouvète</b> les planches du parquet.","Столяр <b>соединяет в паз</b> доски паркета.",Menuiserie. Terme technique. Groupe 1 (-er).,🪚,quebecismes
embâcler,загромождать,v,"Les glaces <b>embâclent</b> la rivière au printemps.","Льды <b>загромождают</b> реку весной.",Aussi: embarrasser. Groupe 1 (-er).,🧊,quebecismes
emmieuter,улучшать,v,"On a <b>emmieuté</b> la recette de grand-mère.","Мы <b>улучшили</b> бабушкин рецепт.",Vieux. France: améliorer. Groupe 1 (-er).,⬆️,quebecismes
une empilade,куча,f,"Il y a une <b>empilade</b> de vêtements sur le lit.","На кровати <b>куча</b> одежды.",Familier. France: entassement / tas.,📦,quebecismes
s'encalmer,штилеть,v,"Le voilier s'est <b>encalmé</b> au milieu du lac.","Парусник <b>заштилел</b> посреди озера.",Maritime. Manque de vent. Groupe 1 (-er).,⛵,quebecismes
encanter,продавать с аукциона,v,"On va <b>encanter</b> les meubles de la succession.","Мебель из наследства <b>пустят с молотка</b>.",France: vendre aux enchères. Groupe 1 (-er).,🔨,quebecismes
un encanteur; une encanteuse,аукционист,m,"L'<b>encanteur</b> a vendu le tableau à bon prix.","<b>Аукционист</b> продал картину за хорошую цену.",France: commissaire-priseur.,🎤,quebecismes
endisquer,записывать на диск,v,"Le groupe a <b>endisqué</b> son premier album.","Группа <b>записала</b> свой первый альбом.",Vieilli. France: enregistrer.,💿,quebecismes
une endormitoire,сонливость,f,"J'ai une <b>endormitoire</b> après le dîner.","После обеда меня клонит в сон (<b>сонливость</b>).",Familier. France: somnolence / envie de dormir.,😪,quebecismes
enfarger,подставлять подножку,v,"Il m'a <b>enfargé</b> dans l'escalier !","Он <b>подставил мне подножку</b> на лестнице!",Aussi: s'enfarger = trébucher. Très courant. Groupe 1 (-er).,🦶,quebecismes
enfirouaper,обманывать,v,"Ne te laisse pas <b>enfirouaper</b> par ce vendeur !","Не дай себя <b>обмануть</b> этому продавцу!",Familier. De in fur wrapped. Très québécois. Groupe 1 (-er).,🎭,quebecismes
un extrant,выходные данные,m,"Les <b>extrants</b> du système sont analysés.","<b>Выходные данные</b> системы анализируются.",Informatique. Terme OQLF. France: output / données de sortie.,📤,quebecismes
des fardoches,кустарник,f,"On s'est perdus dans les <b>fardoches</b>.","Мы заблудились в <b>кустарнике</b>.",Familier. Toujours pluriel. France: broussailles.,🌿,quebecismes
une farlouche,начинка для пирога (из изюма),f,"Grand-mère fait une tarte à la <b>farlouche</b> pour Noël.","Бабушка делает пирог с <b>изюмной начинкой</b> на Рождество.",Aussi: ferlouche. Dessert traditionnel québécois.,🥧,quebecismes
un fifi,гей (пренебр.),m,"Ne sois pas homophobe avec ce mot <b>fifi</b>.","Не будь гомофобом с этим словом <b>fifi</b>.",⚠️ Péjoratif / offensant. À éviter.,⚠️,quebecismes
une flotte,флот,m,"La <b>flotte</b> de pêche est au port.","Рыболовецкий <b>флот</b> в порту.",Même sens qu'en France. Maritime.,⛵,quebecismes
un flânage,праздношатание,m,"Le <b>flânage</b> dans le Vieux-Québec est agréable.","<b>Праздношатание</b> по Старому Квебеку приятно.",France: flânerie. Action de flâner.,🚶,quebecismes
un fort,форт,m,"On a visité le <b>fort</b> de Chambly.","Мы посетили <b>форт</b> Шамбли.",Même sens qu'en France. Patrimoine historique.,🏰,quebecismes
un francisme,франсизм (галлицизм из Франции),m,"Au Québec on évite les <b>francismes</b> comme parking.","В Квебеке избегают <b>франсизмов</b> типа parking.",Opposé: québécisme. Terme propre au français de France.,🇫🇷,quebecismes
frimasser,покрываться инеем,v,"Les vitres <b>frimassent</b> par ce froid.","Стёкла <b>покрываются инеем</b> от этого холода.",Hiver québécois. Groupe 1 (-er).,❄️,quebecismes
un fudge,фадж (помадка),m,"Elle a fait du <b>fudge</b> au chocolat pour la fête.","Она сделала шоколадный <b>фадж</b> на праздник.",Confiserie anglophone populaire au Québec.,🍫,quebecismes
un gadelier,смородина (куст),m,"Le <b>gadelier</b> produit des fruits rouges.","Куст <b>смородины</b> даёт красные ягоды.",Aussi: gadellier. France: groseillier.,🍒,quebecismes
une gadelle,смородина (ягода),f,"On cueille des <b>gadelles</b> dans le jardin.","Мы собираем <b>смородину</b> в саду.",France: groseille. Courant au Québec.,🍒,quebecismes
une garnotte,гравий,f,"La cour est couverte de <b>garnotte</b>.","Двор покрыт <b>гравием</b>.",France: gravier. Courant.,🪨,quebecismes
garrocher,бросать,v,"<b>Garroche</b>-moi la balle !","<b>Брось</b> мне мяч!",Familier. France: lancer / jeter. Groupe 1 (-er).,⚾,quebecismes
un gaspareau,алоза,m,"Les <b>gaspareaux</b> remontent la rivière au printemps.","<b>Алозы</b> поднимаются вверх по реке весной.",Petit poisson marin. Région atlantique.,🐟,quebecismes
glaciel; glacielle,относящийся к плавучим льдам,adj,"Les conditions <b>glacielles</b> sont dangereuses pour les bateaux.","<b>Ледовые</b> условия опасны для судов.",Terme maritime. Golfe du Saint-Laurent.,🧊,quebecismes
un godendart,двуручная пила,m,"Les bûcherons utilisaient le <b>godendart</b> autrefois.","Раньше лесорубы использовали <b>двуручную пилу</b>.",Outil traditionnel. Histoire forestière.,🪚,quebecismes
un gorgoton,глотка,m,"J'ai mal au <b>gorgoton</b> ce matin.","У меня болит <b>глотка</b> этим утром.",Familier. France: gosier / gorge.,🗣️,quebecismes
gosser,строгать ножом,v,"Il aime <b>gosser</b> du bois sur le balcon.","Он любит <b>строгать</b> дерево на балконе.",Aussi: bricoler / perdre son temps. Groupe 1 (-er).,🔪,quebecismes
une grignotine,снэки,f,"On a acheté des <b>grignotines</b> pour le match.","Мы купили <b>снэки</b> на матч.",France: amuse-gueules / chips. Pluriel courant.,🍿,quebecismes
un gripette,капризный ребёнок,m,"Ce petit <b>gripette</b> n'arrête pas de pleurer.","Этот маленький <b>капризуля</b> не перестаёт плакать.",Familier. France: enfant coléreux.,😢,quebecismes
une guidoune,проститутка,f,"Il y a des <b>guidounes</b> dans ce quartier.","В этом районе есть <b>проститутки</b>.",⚠️ Vulgaire. À éviter dans un contexte formel.,⚠️,quebecismes
une guignolée,рождественский сбор пожертвований,f,"La <b>guignolée</b> aide les familles dans le besoin.","<b>Рождественский сбор</b> помогает нуждающимся семьям.",Tradition québécoise. Décembre. Charité.,🎄,quebecismes
une guédille,хот-дог с салатом,f,"J'ai mangé une <b>guédille</b> au homard en Gaspésie.","Я ел <b>хот-дог с лобстером</b> в Гаспези.",Pain à hotdog + salade ou fruits de mer. Spécialité locale.,🌭,quebecismes
une infolettre,рассылка,f,"Abonne-toi à notre <b>infolettre</b> pour les nouvelles.","Подпишись на нашу <b>рассылку</b> для новостей.",Terme OQLF. France: newsletter.,📧,quebecismes
une inhalothérapie,ингаляционная терапия,f,"Elle étudie l'<b>inhalothérapie</b> au cégep.","Она изучает <b>ингаляционную терапию</b> в колледже.",Profession paramédicale. Système respiratoire.,💨,quebecismes
initialer,парафировать,v,"<b>Initialez</b> chaque page du contrat.","<b>Парафируйте</b> каждую страницу контракта.",France: parapher. De initiales. Groupe 1 (-er).,✍️,quebecismes
un intrant,входные данные,m,"Les <b>intrants</b> du système sont vérifiés.","<b>Входные данные</b> системы проверяются.",Informatique. Terme OQLF. France: input / données d'entrée.,📥,quebecismes
une jarnigoine,смекалка,f,"Il a de la <b>jarnigoine</b> ce petit !","У этого малыша есть <b>смекалка</b>!",Familier. France: intelligence / jugeote.,🧠,quebecismes
jasant; jasante,болтливый,adj,"Ma voisine est très <b>jasante</b>.","Моя соседка очень <b>болтливая</b>.",De jaser = bavarder. France: bavard.,💬,quebecismes
une jasette,болтовня,f,"On a eu une bonne <b>jasette</b> autour d'un café.","Мы хорошо <b>поболтали</b> за кофе.",Familier. Faire la jasette = bavarder. Très courant.,☕,quebecismes
le joual,жуаль (квебекский диалект),m,"Mon grand-père parle <b>joual</b>.","Мой дедушка говорит на <b>жуале</b>.",Variété populaire du français québécois. De cheval.,🗣️,quebecismes
une joujouthèque,игротека,f,"Les enfants adorent la <b>joujouthèque</b> du quartier.","Дети обожают <b>игротеку</b> в районе.",France: ludothèque. Emprunt de jouets.,🎮,quebecismes
un jubilaire; une jubilaire,юбиляр,m,"Les <b>jubilaires</b> ont reçu leurs médailles.","<b>Юбиляры</b> получили свои медали.",Personne fêtant un anniversaire important.,🎂,quebecismes
kayakable,пригодный для каякинга,adj,"Cette rivière est <b>kayakable</b> toute l'année.","Эта река <b>пригодна для каякинга</b> весь год.",Plein air. Tourisme d'aventure.,🛶,quebecismes
une laveuse,стиральная машина,f,"J'ai mis le linge dans la <b>laveuse</b>.","Я положил бельё в <b>стиральную машину</b>.",Très courant! France: lave-linge / machine à laver.,🧺,quebecismes
un lettreur; une lettreuse,художник-шрифтовик,m,"Le <b>lettreur</b> a dessiné l'enseigne du magasin.","<b>Художник-шрифтовик</b> нарисовал вывеску магазина.",Métier d'art. France: graphiste spécialisé.,🎨,quebecismes
lousse,свободный (не тугой),adj,"Ma ceinture est trop <b>lousse</b>.","Мой ремень слишком <b>свободный</b>.",De l'anglais loose. Familier. France: lâche.,👖,quebecismes
lyrer,ныть,v,"Il <b>lyre</b> depuis ce matin au sujet de son travail.","Он <b>ноет</b> с утра по поводу работы.",Familier. Pleurnicher sur le même ton. Groupe 1 (-er).,😩,quebecismes
maganer,портить; изнашивать,v,"Tu vas <b>maganer</b> tes chaussures à jouer dehors.","Ты <b>испортишь</b> ботинки играя на улице.",Très courant. France: abîmer / user. Groupe 1 (-er).,👟,quebecismes
magané; maganée,потрёпанный; уставший,adj,"Je suis <b>magané</b> après cette semaine de travail.","Я <b>измотан</b> после этой рабочей недели.",Très courant. France: fatigué / abîmé.,😵,quebecismes
magasiner,ходить по магазинам,v,"On va <b>magasiner</b> au centre commercial.","Мы идём <b>по магазинам</b> в торговый центр.",Très courant! France: faire du shopping. Groupe 1 (-er).,🛍️,quebecismes
une marigane noire,чёрный краппи (рыба),f,"On a pêché des <b>mariganes noires</b> dans le lac.","Мы наловили <b>чёрных краппи</b> в озере.",Poisson d'eau douce. Pêche sportive.,🐟,quebecismes
une mercerie,галантерея,f,"J'ai acheté du fil à la <b>mercerie</b>.","Я купил нитки в <b>галантерее</b>.",Même sens qu'en France. Courant.,🧵,quebecismes
une microbrasserie,крафтовая пивоварня,f,"Cette <b>microbrasserie</b> fait d'excellentes bières.","Эта <b>крафтовая пивоварня</b> делает отличное пиво.",Tendance populaire au Québec. France: brasserie artisanale.,🍺,quebecismes
un millage,пробег (в милях),m,"Quel est le <b>millage</b> de cette voiture ?","Какой <b>пробег</b> у этой машины?",De l'anglais mileage. France: kilométrage.,🚗,quebecismes
minoucher,ласкать,v,"Elle aime <b>minoucher</b> son chat le soir.","Она любит <b>ласкать</b> своего кота вечером.",Familier. De minou = chat. Groupe 1 (-er).,🐱,quebecismes
une minoune,старая машина,f,"Il roule avec sa vieille <b>minoune</b>.","Он ездит на своей старой <b>развалюхе</b>.",Familier. Synonyme: bazou. Aussi: chatte (affectueux).,🚙,quebecismes
une mordée,укус,f,"J'ai une <b>mordée</b> de maringouin sur le bras.","У меня <b>укус</b> комара на руке.",France: morsure / piqûre.,🦟,quebecismes
une motomarine,гидроцикл,f,"On a loué une <b>motomarine</b> pour l'après-midi.","Мы арендовали <b>гидроцикл</b> на день.",Terme OQLF. France: jet-ski / scooter des mers.,🚤,quebecismes
un motton,комок,m,"Il y a des <b>mottons</b> dans la sauce.","В соусе <b>комки</b>.",Familier. France: grumeau.,🥣,quebecismes
une MRC,региональный муниципалитет,f,"Notre village fait partie de la <b>MRC</b> de Portneuf.","Наша деревня входит в <b>региональный муниципалитет</b> Портнёф.",Municipalité régionale de comté. Administration québécoise.,🗺️,quebecismes
mémérer,сплетничать,v,"Les voisines aiment <b>mémérer</b> sur la clôture.","Соседки любят <b>сплетничать</b> у забора.",Familier. De mémère = commère. Groupe 1 (-er).,🗣️,quebecismes
mésadapté; mésadaptée,дезадаптированный,adj,"Ce programme aide les jeunes <b>mésadaptés</b>.","Эта программа помогает <b>дезадаптированным</b> молодым людям.",Terme social/éducatif. France: inadapté.,👤,quebecismes
un nanane,конфетка,m,"Tu veux un <b>nanane</b> mon petit ?","Хочешь <b>конфетку</b> малыш?",Langage enfantin. Aussi: nananne. France: bonbon.,🍬,quebecismes
un niaisage,бездельничанье,m,"Assez de <b>niaisage</b> mets-toi au travail !","Хватит <b>бездельничать</b> — берись за работу!",Familier. Perte de temps. Très courant.,😴,quebecismes
niaiser,дразнить; валять дурака,v,"Arrête de me <b>niaiser</b> !","Хватит меня <b>дразнить</b>!",Très courant. Aussi: perdre son temps. Groupe 1 (-er).,🤪,quebecismes
niaiseux; niaiseuse,глупый; дурак,adj,"C'est <b>niaiseux</b> comme idée.","Это <b>глупая</b> идея.",Très courant! Familier. France: idiot / bête.,🤦,quebecismes
une nordicité,северность,f,"La <b>nordicité</b> définit l'identité du Québec.","<b>Северность</b> определяет идентичность Квебека.",Terme géographique. Concept de Louis-Edmond Hamelin.,❄️,quebecismes
un oka,сыр Ока,m,"Ce <b>oka</b> est fabriqué par les moines.","Этот <b>сыр Ока</b> делают монахи.",Fromage québécois célèbre. Abbaye d'Oka.,🧀,quebecismes
parlable,контактный (о человеке),adj,"Mon patron n'est pas <b>parlable</b> ce matin.","Мой босс <b>не в духе</b> этим утром.",Familier. D'un abord facile. France: abordable.,💬,quebecismes
patenter,мастерить,v,"Il a <b>patenté</b> une solution avec du ruban adhésif.","Он <b>смастерил</b> решение с помощью скотча.",Familier. Bricoler de façon ingénieuse. Groupe 1 (-er).,🔧,quebecismes
patenteux; patenteuse,умелец,adj,"Mon voisin est un vrai <b>patenteux</b>.","Мой сосед — настоящий <b>умелец</b>.",Bricoleur ingénieux. Compliment!,🛠️,quebecismes
un patroneux; une patroneuse,покровитель (полит.),m,"Les <b>patroneux</b> distribuent des faveurs.","<b>Покровители</b> раздают услуги.",Péjoratif. Politique clientéliste.,🏛️,quebecismes
un pembina,калина,m,"On fait de la gelée avec les <b>pembinas</b>.","Из <b>калины</b> делают желе.",Aussi: pimbina. Baie indigène. D'origine amérindienne.,🔴,quebecismes
une perchaude,жёлтый окунь,f,"On a pêché des <b>perchaudes</b> ce matin.","Мы наловили <b>окуней</b> этим утром.",Poisson d'eau douce populaire. Pêche sportive.,🐟,quebecismes
un physiatre; une physiatre,физиатр,m,"Le <b>physiatre</b> m'a prescrit de la physiothérapie.","<b>Физиатр</b> прописал мне физиотерапию.",Médecin spécialisé. France: médecin rééducateur.,👨‍⚕️,quebecismes
une physiatrie,физиатрия,f,"Il se spécialise en <b>physiatrie</b>.","Он специализируется в <b>физиатрии</b>.",Médecine de réadaptation. Terme OQLF.,🏥,quebecismes
une piastre,доллар,f,"Ça coûte cinq <b>piastres</b>.","Это стоит пять <b>долларов</b>.",Familier. Très courant! Historique: pièce espagnole.,💵,quebecismes
une pichenotte,щелчок,f,"Il m'a donné une <b>pichenotte</b> sur l'oreille.","Он дал мне <b>щелбан</b> по уху.",France: pichenette. Aussi: jeu de table.,👆,quebecismes
un pichou,мокасин,m,"Les <b>pichous</b> sont confortables en hiver.","<b>Мокасины</b> удобны зимой.",Chaussure traditionnelle amérindienne.,👟,quebecismes
