French,Russian,WordType,ExampleFrench,ExampleRussian,Notes,Emoji,Source
un abatis,вырубка (частично раскорчёванный участок),m,"Il a défriché <b>un abatis</b> pour agrandir sa terre.","Он расчистил <b>вырубку</b>, чтобы увеличить свой участок.",Région forestière. De l'ancien français abattre.,🪓,quebecismes
un aboiteau,дамба (для осушения прибрежных земель),m,"Les Acadiens ont construit des <b>aboiteaux</b> pour cultiver les marais.","Акадийцы строили <b>дамбы</b> для возделывания болот.",Terme acadien. Technique agricole traditionnelle.,🌊,quebecismes
abrier,укрывать (ребёнка),v,"Viens <b>abrier</b> le petit, il fait froid ce soir.","Иди <b>укрой</b> малыша, сегодня холодно.",Familier. France: couvrir. Groupe 1 (-er).,🛏️,quebecismes
achalant; achalante,надоедливый; назойливый,adj,"Mon voisin est vraiment <b>achalant</b> avec sa musique forte.","Мой сосед реально <b>надоедливый</b> со своей громкой музыкой.",Très courant au Québec. France: ennuyeux.,😤,quebecismes
achaler,надоедать; докучать,v,"Arrête de m'<b>achaler</b> avec tes questions !","Хватит меня <b>доставать</b> своими вопросами!",Très courant. France: ennuyer. Groupe 1 (-er).,🙄,quebecismes
acéricole,относящийся к производству кленового сиропа,adj,"Le Québec est le leader mondial de l'industrie <b>acéricole</b>.","Квебек — мировой лидер в <b>кленовой</b> индустрии.",De érable (acer en latin). Industrie importante au Québec.,🍁,quebecismes
un acétaminophène,парацетамол,m,"Prends un <b>acétaminophène</b> pour ta fièvre.","Прими <b>парацетамол</b> от температуры.",France: paracétamol. Nom commercial: Tylenol.,💊,quebecismes
un adon,совпадение; случайность,m,"C'est tout un <b>adon</b> qu'on se retrouve ici !","Какое <b>совпадение</b>, что мы встретились здесь!",Familier. Synonyme: hasard. Très québécois.,🎲,quebecismes
un affiant; une affiante,лицо дающее показания под присягой,m,"L'<b>affiant</b> a signé sa déclaration devant le notaire.","<b>Заявитель</b> подписал декларацию у нотариуса.",Terme juridique. France: déclarant sous serment.,⚖️,quebecismes
une aidance,помощь зависимому человеку,f,"L'<b>aidance</b> aux personnes âgées est un enjeu social majeur.","<b>Помощь</b> пожилым людям — важная социальная задача.",Néologisme québécois. Concept de proche aidant.,🤝,quebecismes
une allée,аллея,f,"On s'est promenés dans les <b>allées</b> du parc.","Мы гуляли по <b>аллеям</b> парка.",Même sens qu'en France. Courant.,🌳,quebecismes
une aluminerie,алюминиевый завод,f,"Il travaille à l'<b>aluminerie</b> de Jonquière depuis vingt ans.","Он работает на <b>алюминиевом заводе</b> в Жонкьере уже двадцать лет.",Industrie importante au Saguenay. France: usine d'aluminium.,🏭,quebecismes
amancher,обманывать; надувать,v,"Il s'est fait <b>amancher</b> par un vendeur malhonnête.","Его <b>надули</b> нечестный продавец.",Familier. France: arnaquer. Groupe 1 (-er).,🎭,quebecismes
un anovulant,противозачаточное средство,m,"Elle prend un <b>anovulant</b> depuis plusieurs années.","Она принимает <b>противозачаточные</b> уже несколько лет.",Terme médical québécois. France: contraceptif oral.,💊,quebecismes
aplomber,выравнивать,v,"Il faut <b>aplomber</b> cette étagère avant de la fixer.","Нужно <b>выровнять</b> эту полку перед креплением.",D'aplomb. France: mettre d'aplomb. Groupe 1 (-er).,📐,quebecismes
un aréna,крытый каток,m,"Les enfants jouent au hockey à l'<b>aréna</b> du quartier.","Дети играют в хоккей на <b>катке</b> в районе.",Très courant. France: patinoire couverte. Masculin au Québec!,⛸️,quebecismes
un ataca,клюква,m,"On fait de la confiture avec des <b>atacas</b> du jardin.","Мы делаем варенье из <b>клюквы</b> с огорода.",Aussi: atoca. D'origine amérindienne. France: canneberge.,🔴,quebecismes
attoquer,прислонять (акадийск.),v,"<b>Attoque</b> l'échelle contre le mur.","<b>Прислони</b> лестницу к стене.",Acadien. Familier. Groupe 1 (-er).,🪜,quebecismes
s'attriquer,наряжаться,v,"Elle s'est <b>attriquée</b> pour la soirée.","Она <b>нарядилась</b> для вечеринки.",Familier. France: s'attifer. Groupe 1 (-er).,👗,quebecismes
une autopatrouille,полицейский автомобиль,f,"L'<b>autopatrouille</b> est arrivée en cinq minutes.","<b>Полицейская машина</b> приехала через пять минут.",Officiel au Québec. France: voiture de police.,🚔,quebecismes
une avionnerie,авиазавод,f,"Bombardier a fermé son <b>avionnerie</b> à Mirabel.","Bombardier закрыл свой <b>авиазавод</b> в Мирабеле.",Industrie aéronautique québécoise. France: usine d'avions.,✈️,quebecismes
une aérobique,аэробика,f,"Elle fait de l'<b>aérobique</b> trois fois par semaine.","Она занимается <b>аэробикой</b> три раза в неделю.",Aussi: aérobic. Anglicisme adapté.,🏃‍♀️,quebecismes
une babiche,ремешок из сыромятной кожи,f,"Les raquettes traditionnelles sont tressées en <b>babiche</b>.","Традиционные снегоступы плетут из <b>сыромятных ремешков</b>.",D'origine amérindienne. Artisanat traditionnel.,🦌,quebecismes
un babillard électronique,электронная доска объявлений (BBS),m,"Dans les années 90 on se connectait aux <b>babillards électroniques</b>.","В 90-х подключались к <b>электронным доскам объявлений</b>.",Terme officiel OQLF. France: forum (historique).,💻,quebecismes
une baboune,губа; надутые губы,f,"Arrête de faire la <b>baboune</b> et viens manger !","Хватит <b>дуть губы</b>, иди есть!",Familier. Faire la baboune = bouder.,😤,quebecismes
un bac,паром,m,"On a traversé le fleuve en <b>bac</b> à Tadoussac.","Мы пересекли реку на <b>пароме</b> в Тадуссаке.",Traversier à fond plat. Courant au Québec.,⛴️,quebecismes
une bagosse,самогон,m,"Mon grand-père faisait de la <b>bagosse</b> dans le temps.","Мой дедушка гнал <b>самогон</b> в своё время.",Alcool artisanal illégal. Familier.,🥃,quebecismes
un balado,подкаст,m,"J'écoute un <b>balado</b> sur l'histoire du Québec.","Я слушаю <b>подкаст</b> об истории Квебека.",Terme officiel OQLF. France: podcast. Très courant.,🎧,quebecismes
une baladodiffusion,подкастинг,f,"La <b>baladodiffusion</b> est devenue populaire au Québec.","<b>Подкастинг</b> стал популярен в Квебеке.",Terme officiel OQLF. France: podcasting.,📡,quebecismes
une balloune,воздушный шарик; алкотестер,f,"Les enfants jouent avec des <b>ballounes</b> à la fête.","Дети играют с <b>шариками</b> на празднике.",Familier. Aussi: souffler dans la balloune = passer l'alcootest.,🎈,quebecismes
bardasser,трясти; толкать,v,"Le vent <b>bardasse</b> les volets toute la nuit.","Ветер <b>хлопает</b> ставнями всю ночь.",Aussi: berdasser. Familier. Groupe 1 (-er).,💨,quebecismes
une barrure,засов,f,"Mets la <b>barrure</b> sur la porte avant de partir.","Задвинь <b>засов</b> на двери перед уходом.",France: verrou. Courant au Québec.,🔒,quebecismes
une bassinette,детская кроватка,f,"Le bébé dort dans sa <b>bassinette</b>.","Малыш спит в своей <b>кроватке</b>.",France: lit à barreaux / berceau. Courant.,👶,quebecismes
une batture,отмель (при отливе),f,"On ramasse des coquillages sur la <b>batture</b>.","Мы собираем ракушки на <b>отмели</b>.",Terme maritime. Région du Saint-Laurent.,🐚,quebecismes
un bavardoir,чат,m,"Dans le <b>bavardoir</b> on peut discuter en temps réel.","В <b>чате</b> можно общаться в реальном времени.",Terme OQLF. Plus courant: clavardage.,💬,quebecismes
un bazou,старая развалюха (машина),m,"Il roule encore avec son vieux <b>bazou</b> rouillé.","Он всё ещё ездит на своей старой ржавой <b>развалюхе</b>.",Familier. Synonyme: minoune. Très québécois.,🚗,quebecismes
un bec,поцелуй,m,"Donne-moi un petit <b>bec</b> avant de partir !","Дай мне <b>чмок</b> перед уходом!",Familier. Donner un bec = faire un bisou. Très courant.,💋,quebecismes
un beigne,пончик,m,"Je vais chercher des <b>beignes</b> au Tim Hortons.","Схожу за <b>пончиками</b> в Tim Hortons.",Icône québécoise. France: beignet (différent).,🍩,quebecismes
une beignerie,пончиковая,f,"Il y a une <b>beignerie</b> au coin de la rue.","На углу есть <b>пончиковая</b>.",France: boutique de beignets.,🏪,quebecismes
un bidou,деньги; бабки,m,"Je n'ai plus de <b>bidous</b> pour finir le mois.","У меня нет <b>бабок</b> дотянуть до конца месяца.",Familier. Synonyme: argent. Souvent au pluriel.,💵,quebecismes
une binerie,забегаловка,f,"On a mangé dans une petite <b>binerie</b> du Vieux-Montréal.","Мы поели в маленькой <b>забегаловке</b> Старого Монреаля.",De beans (fèves au lard). Restaurant simple.,🍽️,quebecismes
un bleuet,черника (голубика),m,"On a cueilli des <b>bleuets</b> au Lac-Saint-Jean.","Мы собирали <b>чернику</b> на Лак-Сен-Жане.",Baie emblématique du Québec. Saguenay = capitale du bleuet.,🫐,quebecismes
une bleueterie,черничная ферма,f,"La <b>bleueterie</b> ouvre en juillet pour l'autocueillette.","<b>Черничная ферма</b> открывается в июле для самосбора.",Région du Saguenay–Lac-Saint-Jean.,🏕️,quebecismes
une blonde,девушка (подруга),f,"Je te présente ma <b>blonde</b> Marie.","Познакомься с моей <b>девушкой</b> Мари.",Très courant! France: copine/petite amie. Pas lié à la couleur des cheveux!,👩‍❤️‍👨,quebecismes
des bobettes,трусы,f,"J'ai besoin de nouvelles <b>bobettes</b>.","Мне нужны новые <b>трусы</b>.",Familier. Toujours pluriel. France: slip/caleçon.,🩲,quebecismes
un boire,кормление (грудью),m,"C'est l'heure du <b>boire</b> pour le bébé.","Пора <b>кормить</b> малыша.",Québec: nom. France: verbe seulement (boire).,🍼,quebecismes
une boucane,дым,f,"Il y a de la <b>boucane</b> qui sort de la cheminée.","Из трубы идёт <b>дым</b>.",Familier. France: fumée. D'origine amérindienne.,💨,quebecismes
une bouette,грязь,f,"Essuie tes bottes il y a de la <b>bouette</b> partout !","Вытри сапоги — везде <b>грязь</b>!",Familier. France: boue. Aussi: gadoue.,🥾,quebecismes
bougonneux; bougonneuse,ворчливый,adj,"Mon grand-père est un peu <b>bougonneux</b> le matin.","Мой дедушка немного <b>ворчливый</b> по утрам.",France: grognon/bougon.,😠,quebecismes
une bougrine,утеплённая куртка,f,"Mets ta <b>bougrine</b> il fait frette dehors !","Надень <b>куртку</b> — на улице холодно!",Veste chaude. Terme traditionnel québécois.,🧥,quebecismes
un bourgot,морская улитка,m,"On mange des <b>bourgots</b> dans les restaurants de la Gaspésie.","В ресторанах Гаспези едят <b>морских улиток</b>.",Fruits de mer. Région maritime du Québec.,🐚,quebecismes
bourrasser,грубить; толкать,v,"Arrête de <b>bourrasser</b> ton petit frère !","Хватит <b>толкать</b> младшего брата!",Familier. France: bousculer. Groupe 1 (-er).,👊,quebecismes
un bouscueil,торосы (нагромождение льда),m,"Le <b>bouscueil</b> bloque le passage sur le fleuve.","<b>Торосы</b> перекрывают проход по реке.",Terme maritime hivernal. Saint-Laurent.,🧊,quebecismes
branleux; branleuse,нерешительный человек,adj,"Il est trop <b>branleux</b> pour prendre une décision.","Он слишком <b>нерешительный</b>, чтобы принять решение.",Familier. France: indécis. Péjoratif.,🤔,quebecismes
une braoule,большая ложка (устар.),f,"Grand-mère remuait la soupe avec sa <b>braoule</b>.","Бабушка помешивала суп своей <b>большой ложкой</b>.",Vieux. Terme traditionnel québécois.,🥄,quebecismes
un breffage,брифинг,m,"Le premier ministre donne un <b>breffage</b> à la presse.","Премьер-министр проводит <b>брифинг</b> для прессы.",Terme officiel OQLF. France: briefing.,📋,quebecismes
breffer,проводить брифинг,v,"Le directeur va <b>breffer</b> l'équipe ce matin.","Директор <b>проведёт брифинг</b> команды этим утром.",Terme OQLF. France: briefer. Groupe 1 (-er).,📢,quebecismes
bretteux; bretteuse,бездельник,adj,"Mon coloc est un vrai <b>bretteux</b> qui ne fait rien.","Мой сосед — настоящий <b>бездельник</b>, ничего не делает.",Familier. France: fainéant. Bretter = perdre son temps.,😴,quebecismes
une broue,пена; пузыри,f,"Il y a de la <b>broue</b> sur ma bière.","На моём пиве <b>пена</b>.",Familier. Aussi: péter de la broue = se vanter.,🍺,quebecismes
une brunante,сумерки,f,"On rentre à la maison à la <b>brunante</b>.","Мы возвращаемся домой в <b>сумерках</b>.",Très poétique. France: crépuscule. Courant au Québec.,🌆,quebecismes
une bébelle,игрушка; безделушка,f,"Les enfants ont laissé leurs <b>bébelles</b> partout.","Дети разбросали свои <b>игрушки</b> повсюду.",Familier. France: jouet / bibelot.,🧸,quebecismes
une bébitte,букашка,f,"Il y a une <b>bébitte</b> dans la cuisine !","На кухне <b>букашка</b>!",Familier. France: bestiole. Aussi: insecte en général.,🐛,quebecismes
les bécosses,туалет (уличный),f,"Les <b>bécosses</b> sont derrière le chalet.","<b>Туалет</b> за коттеджем.",Familier. De l'anglais backhouse. Toujours pluriel.,🚽,quebecismes
cabaler,агитировать,v,"Il <b>cabale</b> pour le parti depuis des années.","Он <b>агитирует</b> за партию уже много лет.",Politique. France: faire campagne. Groupe 1 (-er).,🗳️,quebecismes
caller,объявлять фигуры (в танце),v,"Le musicien <b>calle</b> les sets carrés.","Музыкант <b>объявляет фигуры</b> кадрили.",Danses folkloriques québécoises. De l'anglais to call.,💃,quebecismes
un calleur,ведущий народных танцев,m,"Le <b>calleur</b> anime la soirée de danse traditionnelle.","<b>Ведущий</b> оживляет вечер народных танцев.",Folklore québécois. Sets carrés.,🎤,quebecismes
canotable,пригодный для гребли,adj,"Cette rivière est <b>canotable</b> tout l'été.","Эта река <b>пригодна для гребли</b> всё лето.",Plein air. Canot = kayak/canoe.,🛶,quebecismes
canter,наклонять; кренить,v,"<b>Cante</b> un peu la table pour la déplacer.","<b>Наклони</b> немного стол, чтобы передвинуть.",Familier. France: pencher. Groupe 1 (-er).,↗️,quebecismes
carreauté; carreautée,в клетку (о ткани),adj,"Il porte toujours des chemises <b>carreautées</b>.","Он всегда носит <b>клетчатые</b> рубашки.",France: à carreaux. Adjectif courant.,👔,quebecismes
un cassot,лоток (для ягод),m,"J'ai acheté un <b>cassot</b> de fraises au marché.","Я купил <b>лоток</b> клубники на рынке.",Petit contenant. Courant au marché.,🍓,quebecismes
une catalogne,домотканый коврик,f,"Grand-mère a tissé cette <b>catalogne</b> à la main.","Бабушка соткала этот <b>коврик</b> вручную.",Artisanat traditionnel québécois. Textile.,🧵,quebecismes
catiner,играть в куклы; нянчить,v,"Elle aime <b>catiner</b> ses petites sœurs.","Она любит <b>нянчить</b> своих младших сестёр.",Familier. De catin = poupée. Groupe 1 (-er).,🎎,quebecismes
un caucus,закрытое совещание партии,m,"Les députés se réunissent en <b>caucus</b> chaque semaine.","Депутаты собираются на <b>совещание</b> каждую неделю.",Terme politique. De l'anglais. Courant au Canada.,🏛️,quebecismes
un cenellier,боярышник,m,"Les oiseaux mangent les fruits du <b>cenellier</b>.","Птицы едят плоды <b>боярышника</b>.",Aussi: senellier. Arbre indigène.,🌳,quebecismes
une cenne,цент,f,"Je n'ai pas une <b>cenne</b> sur moi.","У меня нет ни <b>цента</b>.",Familier. De l'anglais cent. Très courant.,🪙,quebecismes
un chalin,зарница,m,"On voit des <b>chalins</b> à l'horizon ce soir.","Сегодня вечером на горизонте видны <b>зарницы</b>.",Éclair de chaleur sans tonnerre. Poétique.,⚡,quebecismes
chambranlant; chambranlante,шаткий,adj,"Cette vieille chaise est <b>chambranlante</b>.","Этот старый стул <b>шаткий</b>.",France: branlant / bancal.,🪑,quebecismes
chambranler,шататься,v,"La table <b>chambranle</b> sur le plancher inégal.","Стол <b>шатается</b> на неровном полу.",France: chanceler. Groupe 1 (-er).,🔄,quebecismes
un chambreur; une chambreuse,квартирант,m,"Le <b>chambreur</b> paie son loyer le premier du mois.","<b>Квартирант</b> платит арендную плату первого числа.",France: locataire d'une chambre.,🏠,quebecismes
une champleure,кран,f,"Ferme la <b>champleure</b> tu gaspilles l'eau !","Закрой <b>кран</b> — ты тратишь воду!",Aussi: champlure. France: robinet.,🚰,quebecismes
chaudasse,подвыпивший,adj,"Il est un peu <b>chaudasse</b> après trois bières.","Он немного <b>подвыпивший</b> после трёх пива.",Familier. France: éméché / pompette.,🍻,quebecismes
une chaudierée,ведро (содержимое),f,"On a ramassé une <b>chaudierée</b> de bleuets.","Мы набрали <b>ведро</b> черники.",Contenu d'une chaudière (seau). Courant.,🪣,quebecismes
un chialage,нытьё; жалобы,m,"J'en ai assez de ton <b>chialage</b> constant !","Мне надоело твоё постоянное <b>нытьё</b>!",Familier. Verbe: chialer = se plaindre.,😩,quebecismes
chialeux; chialeuse,нытик,adj,"Arrête d'être <b>chialeux</b> et fais quelque chose !","Хватит быть <b>нытиком</b> и сделай что-нибудь!",Familier. Très courant. France: râleur.,😤,quebecismes
une chicane,шикана (дорожное сужение),f,"Il y a une <b>chicane</b> pour ralentir les voitures.","Там есть <b>шикана</b> для замедления машин.",Aussi: querelle (sens commun). Terme routier.,🚧,quebecismes
une chicouté,морошка,f,"On cueille la <b>chicouté</b> dans les tourbières du Nord.","Мы собираем <b>морошку</b> на болотах Севера.",Baie nordique. D'origine amérindienne.,🍊,quebecismes
un chiro,хиропрактик,m,"Je vais voir mon <b>chiro</b> pour mon mal de dos.","Я иду к <b>хиропрактику</b> из-за боли в спине.",Abréviation courante. France: chiropracteur.,🏥,quebecismes
une chiropratique,хиропрактика,f,"Il étudie la <b>chiropratique</b> à l'université.","Он изучает <b>хиропрактику</b> в университете.",Terme officiel. France: chiropraxie.,💆,quebecismes
un chum,друг; парень; бойфренд,m,"Je sors avec mon <b>chum</b> ce soir.","Я иду гулять со своим <b>парнем</b> сегодня.",Très courant! Ami ou petit ami selon contexte. De l'anglais.,👦,quebecismes
chèrant; chèrante,дорогой (о продавце),adj,"Ce magasin est <b>chèrant</b> pour rien.","Этот магазин <b>дерёт</b> цены ни за что.",Familier. France: qui vend cher.,💸,quebecismes
un cinéparc,автокинотеатр,m,"On va au <b>cinéparc</b> voir un film en voiture.","Мы идём в <b>автокинотеатр</b> смотреть фильм из машины.",Nostalgie des années 50-70. Encore quelques-uns au Québec.,🎬,quebecismes
un cipaille,мясной пирог (слоёный),m,"Ma grand-mère fait le meilleur <b>cipaille</b> de la région.","Моя бабушка делает лучший <b>мясной пирог</b> в регионе.",Aussi: cipâte. Plat traditionnel du temps des fêtes.,🥧,quebecismes
un cisco,сиг,m,"On a pêché des <b>ciscos</b> dans le lac.","Мы наловили <b>сигов</b> в озере.",Poisson d'eau douce. Région des lacs.,🐟,quebecismes
clavarder,общаться в чате,v,"Les ados passent des heures à <b>clavarder</b>.","Подростки часами <b>сидят в чате</b>.",Terme OQLF. De clavier + bavarder. Très courant.,💬,quebecismes
se colletailler,препираться,v,"Les enfants se <b>colletaillent</b> pour la télécommande.","Дети <b>препираются</b> из-за пульта.",Familier. France: se chamailler. Groupe 1 (-er).,🤼,quebecismes
colleux; colleuse,ласковый,adj,"Mon chat est très <b>colleux</b> ce soir.","Мой кот очень <b>ласковый</b> сегодня.",Familier. Aime les câlins. France: câlin (adj).,🤗,quebecismes
collégial; collégiale,относящийся к колледжу (cégep),adj,"Elle a terminé ses études <b>collégiales</b>.","Она закончила <b>колледж</b>.",Système éducatif québécois unique. Après secondaire avant université.,🎓,quebecismes
un comité exécutif,исполнительный комитет,m,"Le <b>comité exécutif</b> se réunit demain matin.","<b>Исполнительный комитет</b> собирается завтра утром.",Terme administratif. Courant.,📊,quebecismes
une commune,общинное пастбище,f,"Les vaches paissent sur la <b>commune</b> du village.","Коровы пасутся на <b>общинном пастбище</b>.",Terme agricole traditionnel. Région rurale.,🐄,quebecismes
compétitionner,конкурировать,v,"Notre entreprise <b>compétitionne</b> sur le marché mondial.","Наша компания <b>конкурирует</b> на мировом рынке.",France: être en compétition. Groupe 1 (-er).,🏆,quebecismes
un cométique,собачьи нарты,m,"Les Inuits voyagent en <b>cométique</b> dans le Grand Nord.","Инуиты путешествуют на <b>собачьих нартах</b> на Крайнем Севере.",Du inuktitut. Région arctique.,🛷,quebecismes
un condo,кондоминиум,m,"On a acheté un <b>condo</b> au centre-ville.","Мы купили <b>кондо</b> в центре города.",Abréviation courante. France: appartement en copropriété.,🏢,quebecismes
un conventum,встреча выпускников,m,"J'ai revu mes amis au <b>conventum</b> du cégep.","Я встретил друзей на <b>встрече выпускников</b> колледжа.",Du latin. France: réunion d'anciens élèves.,🎓,quebecismes
un coqueron,каморка,m,"Il vit dans un petit <b>coqueron</b> près du port.","Он живёт в маленькой <b>каморке</b> у порта.",Familier. Logement exigu. Aussi: recoin d'un navire.,🚪,quebecismes
un coquetel,коктейль,m,"On sert des <b>coquetels</b> à la réception.","На приёме подают <b>коктейли</b>.",Orthographe québécoise. France: cocktail.,🍸,quebecismes
un cossin,безделушка,m,"Il collectionne des <b>cossins</b> inutiles.","Он коллекционирует бесполезные <b>безделушки</b>.",Familier. France: babiole / truc.,🎁,quebecismes
couetté; couettée,взъерошенный,adj,"Tu es tout <b>couetté</b> ce matin !","Ты весь <b>взъерошенный</b> этим утром!",Familier. France: ébouriffé.,🙆,quebecismes
