French,Russian,WordType,ExampleFrench,ExampleRussian,Notes,Emoji,Source
picosser,клевать,v,"Les poules <b>picossent</b> le grain.","Куры <b>клюют</b> зерно.",Familier. France: picorer. Groupe 1 (-er).,🐔,quebecismes
une picouille,кляча,f,"Cette vieille <b>picouille</b> ne peut plus travailler.","Эта старая <b>кляча</b> больше не может работать.",Familier. France: haridelle. Cheval maigre.,🐴,quebecismes
une pinotte,арахис,f,"J'ai acheté un sac de <b>pinottes</b>.","Я купил пакет <b>арахиса</b>.",Familier. De l'anglais peanut. Très courant.,🥜,quebecismes
une piquerie,притон,f,"La police a fermé une <b>piquerie</b> dans le quartier.","Полиция закрыла <b>притон</b> в районе.",Lieu où on se drogue. Argot.,💉,quebecismes
pitonner,переключать каналы,v,"Arrête de <b>pitonner</b> et choisis une émission !","Хватит <b>щёлкать каналы</b> — выбери программу!",Familier. De piton = bouton. Groupe 1 (-er).,📺,quebecismes
un pitou,собачка; милый,m,"Viens ici mon <b>pitou</b> !","Иди сюда мой <b>милый</b>!",Familier. Chien ou terme affectueux pour un enfant.,🐕,quebecismes
placoter,болтать,v,"On a <b>placoté</b> pendant des heures.","Мы <b>болтали</b> часами.",Familier. France: bavarder. Groupe 1 (-er).,💬,quebecismes
un plugiciel,плагин,m,"Installe ce <b>plugiciel</b> pour ouvrir le fichier.","Установи этот <b>плагин</b> чтобы открыть файл.",Terme OQLF. France: plugin / module d'extension.,🔌,quebecismes
un podiatre; une podiatre,подиатр,m,"Le <b>podiatre</b> soigne mes ongles incarnés.","<b>Подиатр</b> лечит мои вросшие ногти.",Spécialiste des pieds. France: pédicure-podologue.,🦶,quebecismes
une podiatrie,подиатрия,f,"Elle étudie la <b>podiatrie</b> à l'université.","Она изучает <b>подиатрию</b> в университете.",Médecine des pieds. Terme OQLF.,🏥,quebecismes
podiatrique,подиатрический,adj,"Ce cabinet offre des soins <b>podiatriques</b>.","Этот кабинет предлагает <b>подиатрические</b> услуги.",Relatif à la podiatrie.,🦶,quebecismes
pogner,хватать,v,"<b>Pogne</b> la balle !","<b>Лови</b> мяч!",Très courant! Familier. Aussi: avoir du succès. Groupe 1 (-er).,✊,quebecismes
une polyvalente,общеобразовательная школа,f,"J'ai étudié à la <b>polyvalente</b> du quartier.","Я учился в <b>общеобразовательной школе</b> района.",École secondaire publique québécoise. Système éducatif.,🏫,quebecismes
poquer,бить (оставлять синяки),v,"Il s'est <b>poqué</b> le genou en tombant.","Он <b>ушиб</b> колено при падении.",Familier. France: meurtrir. Groupe 1 (-er).,🤕,quebecismes
portager,переносить лодку (волок),v,"Il faut <b>portager</b> sur deux kilomètres.","Нужно <b>перенести лодку</b> на два километра.",Canot-camping. Tradition voyageur. Groupe 1 (-er).,🛶,quebecismes
un poulamon,атлантический томкод,m,"On pêche le <b>poulamon</b> à Sainte-Anne-de-la-Pérade.","<b>Пуламона</b> ловят в Сент-Анн-де-ла-Перад.",Petit poisson des chenaux. Pêche hivernale traditionnelle.,🐟,quebecismes
une pourvoirie,охотничье-рыболовная база,f,"On va à la <b>pourvoirie</b> pour la chasse à l'orignal.","Мы едем на <b>охотничью базу</b> за лосем.",Tourisme de chasse et pêche. Très québécois.,🏕️,quebecismes
une poutine,путин (картофель фри с сыром),f,"Je vais prendre une <b>poutine</b> pour emporter.","Я возьму <b>путин</b> с собой.",Plat emblématique du Québec! Frites + fromage en grains + sauce.,🍟,quebecismes
une pépine,экскаватор,f,"La <b>pépine</b> creuse les fondations.","<b>Экскаватор</b> копает фундамент.",Familier. France: pelleteuse / excavatrice.,🚜,quebecismes
péquiste,член Квебекской партии,adj,"Mon oncle est <b>péquiste</b> depuis toujours.","Мой дядя всегда был <b>сторонником PQ</b>.",Parti Québécois (PQ). Politique québécoise.,🏛️,quebecismes
un quilleur; une quilleuse,игрок в боулинг,m,"Les <b>quilleurs</b> se retrouvent le mardi soir.","<b>Игроки в боулинг</b> встречаются по вторникам вечером.",France: joueur de bowling. De quilles.,🎳,quebecismes
quétaine,безвкусный,adj,"Cette décoration est vraiment <b>quétaine</b>.","Это украшение реально <b>безвкусное</b>.",Très courant! De mauvais goût. Kitsch.,🎀,quebecismes
une quétainerie,безвкусица,f,"Cette boutique vend des <b>quétaineries</b>.","Этот магазин продаёт <b>безвкусицу</b>.",Objet de mauvais goût. De quétaine.,🗑️,quebecismes
un quêteux; une quêteuse,попрошайка,m,"Un <b>quêteux</b> m'a demandé de l'argent.","<b>Попрошайка</b> попросил у меня денег.",Familier. France: mendiant.,🙏,quebecismes
un rabaska,большое каноэ,m,"On fait du <b>rabaska</b> sur le lac.","Мы катаемся на <b>большом каноэ</b> по озеру.",Grand canot (10+ personnes). Activité de groupe.,🛶,quebecismes
une rabiole,репа (белая),f,"Grand-mère fait une soupe aux <b>rabioles</b>.","Бабушка делает суп из <b>репы</b>.",Variété de navet blanc. Légume traditionnel.,🥕,quebecismes
raboudiner,чинить кое-как,v,"Il a <b>raboudiné</b> la clôture avec du fil de fer.","Он <b>кое-как починил</b> забор проволокой.",Familier. France: rafistoler. Groupe 1 (-er).,🔨,quebecismes
un ramancheur; une ramancheuse,костоправ,m,"Le <b>ramancheur</b> a remis son épaule en place.","<b>Костоправ</b> вправил ему плечо.",France: rebouteux. Guérisseur traditionnel.,💆,quebecismes
rapailler,собирать (разбросанное),v,"<b>Rapaille</b> tes affaires avant de partir !","<b>Собери</b> свои вещи перед уходом!",Familier. France: rassembler. Groupe 1 (-er).,📦,quebecismes
se raplomber,восстанавливать равновесие,v,"Après sa maladie elle s'est <b>raplombée</b>.","После болезни она <b>восстановилась</b>.",Familier. Retrouver son équilibre. Groupe 1 (-er).,⚖️,quebecismes
un recherchiste; une recherchiste,исследователь (на ТВ),m,"Le <b>recherchiste</b> prépare le contenu de l'émission.","<b>Исследователь</b> готовит содержание передачи.",Métier des médias. France: documentaliste.,🔍,quebecismes
un reculon,заусенец,m,"J'ai un <b>reculon</b> douloureux sur le doigt.","У меня болезненный <b>заусенец</b> на пальце.",France: envie (peau). Familier.,💅,quebecismes
un registraire; une registraire,регистратор,m,"Le <b>registraire</b> gère les inscriptions des étudiants.","<b>Регистратор</b> управляет записью студентов.",Administration universitaire. Terme OQLF.,📋,quebecismes
un relationniste; une relationniste,специалист по связям с общественностью,m,"Le <b>relationniste</b> prépare le communiqué de presse.","<b>Специалист по PR</b> готовит пресс-релиз.",France: attaché de presse / chargé de relations publiques.,📢,quebecismes
un rembourreur; une rembourreuse,обивщик мебели,m,"Le <b>rembourreur</b> a refait notre vieux canapé.","<b>Обивщик</b> обновил наш старый диван.",Métier artisanal. France: tapissier.,🛋️,quebecismes
renforcir,укреплять,v,"Il faut <b>renforcir</b> la structure du toit.","Нужно <b>укрепить</b> структуру крыши.",Familier. France: renforcer. Groupe 2 (-ir).,💪,quebecismes
renipper,обновлять,v,"On va <b>renipper</b> la cuisine cet été.","Мы <b>обновим</b> кухню этим летом.",Familier. France: rénover / embellir. Groupe 1 (-er).,🏠,quebecismes
retiger,давать новые побеги,v,"Les tulipes <b>retigent</b> chaque printemps.","Тюльпаны <b>дают новые побеги</b> каждую весну.",Jardinage. Groupe 1 (-er).,🌱,quebecismes
retontir,появляться снова,v,"Il a <b>retonti</b> sans prévenir.","Он <b>снова появился</b> без предупреждения.",Familier. France: réapparaître. Groupe 2 (-ir).,👋,quebecismes
revirer,переворачивать,v,"<b>Revire</b> les crêpes dans la poêle.","<b>Переверни</b> блины на сковороде.",Familier. France: retourner. Groupe 1 (-er).,🥞,quebecismes
une robine,денатурат,f,"Les itinérants boivent parfois de la <b>robine</b>.","Бездомные иногда пьют <b>денатурат</b>.",Alcool dénaturé. Argot. Dangereux!,🍶,quebecismes
un robineux,бомж-алкоголик,m,"Il y a des <b>robineux</b> sous le pont.","Под мостом есть <b>бомжи-алкоголики</b>.",Familier. Clochard qui boit de la robine.,🧔,quebecismes
une ruelle,переулок,f,"Les enfants jouent dans la <b>ruelle</b> derrière la maison.","Дети играют в <b>переулке</b> за домом.",Au Québec: passage entre deux rangées de maisons. Vie de quartier.,🏘️,quebecismes
une région,регион,m,"Le Québec compte 17 <b>régions</b> administratives.","В Квебеке 17 административных <b>регионов</b>.",Même sens qu'en France. Administration.,🗺️,quebecismes
une région administrative,административный регион,f,"Montréal est une <b>région administrative</b>.","Монреаль — <b>административный регион</b>.",Division territoriale québécoise. 17 régions.,📍,quebecismes
un réusinage,рефакторинг,m,"Le <b>réusinage</b> du code a pris deux semaines.","<b>Рефакторинг</b> кода занял две недели.",Informatique. Terme OQLF. France: refactoring.,💻,quebecismes
un sacre,ругательство (религ.),m,"Il a lâché un <b>sacre</b> en se cognant le pied.","Он выругался, ударившись ногой.",Juron d'origine religieuse (tabarnak câlice etc.). Très québécois!,🤬,quebecismes
sacrer,ругаться,v,"Il <b>sacre</b> quand il est en colère.","Он <b>ругается</b> когда злится.",Blasphémer avec des termes religieux. Groupe 1 (-er).,😤,quebecismes
une saucette,быстрое купание,f,"On va faire une <b>saucette</b> dans le lac.","Мы пойдём <b>быстро окунуться</b> в озере.",Familier. France: trempette / baignade rapide.,🏊,quebecismes
un sentier,тропа,m,"On marche sur le <b>sentier</b> de randonnée.","Мы идём по <b>тропе</b> для походов.",Même sens qu'en France. Nature.,🥾,quebecismes
une session,сессия,f,"La <b>session</b> d'automne commence en septembre.","Осенняя <b>сессия</b> начинается в сентябре.",Au Québec: semestre universitaire. France: période d'examens.,📚,quebecismes
un siffleux,сурок,m,"Le <b>siffleux</b> sort de son terrier au printemps.","<b>Сурок</b> выходит из норы весной.",France: marmotte. Animal emblématique. Jour de la marmotte!,🦫,quebecismes
un solage,фундамент,m,"Le <b>solage</b> de la maison a besoin de réparations.","<b>Фундамент</b> дома нуждается в ремонте.",France: fondations. Construction.,🏗️,quebecismes
songé; songée,продуманный; умный,adj,"C'est une réponse <b>songée</b>.","Это <b>продуманный</b> ответ.",Familier. France: réfléchi / bien pensé.,🤔,quebecismes
une soupane,овсяная каша,f,"Grand-mère nous faisait de la <b>soupane</b> le matin.","Бабушка делала нам <b>овсянку</b> по утрам.",Traditionnel. France: bouillie d'avoine / porridge.,🥣,quebecismes
un sparage,кривляние,m,"Arrête ton <b>sparage</b> tu es ridicule !","Хватит <b>кривляться</b> — ты смешон!",Familier. Gesticulation ridicule.,🤡,quebecismes
séraphin,скряга,adj,"Mon oncle est <b>séraphin</b> avec son argent.","Мой дядя <b>скряга</b> со своими деньгами.",Du personnage Séraphin Poudrier. Roman/série TV québécoise.,💰,quebecismes
tapocher,бить,v,"Ne <b>tapoche</b> pas ton frère !","Не <b>бей</b> своего брата!",Familier. France: frapper. Groupe 1 (-er).,👊,quebecismes
taponner,мять,v,"Il <b>taponne</b> son chapeau nerveusement.","Он нервно <b>мнёт</b> свою шляпу.",Familier. Manipuler nerveusement. Groupe 1 (-er).,🎩,quebecismes
tataouiner,мешкать,v,"Arrête de <b>tataouiner</b> et décide-toi !","Хватит <b>мешкать</b> — решайся!",Familier. France: tergiverser. Groupe 1 (-er).,⏳,quebecismes
une tire,тянучка (конфета),f,"On fait de la <b>tire</b> sur la neige au temps des sucres.","Мы делаем <b>тянучку</b> на снегу в сезон сахара.",Tire d'érable sur neige. Tradition du temps des sucres!,🍁,quebecismes
tocson; tocsonne,упрямец,adj,"Il est <b>tocson</b> comme une mule.","Он <b>упрямый</b> как осёл.",Familier. France: têtu / buté.,🫏,quebecismes
un touladi,озёрная форель,m,"On a pêché un beau <b>touladi</b> de dix livres.","Мы поймали красивую <b>озёрную форель</b> на десять фунтов.",Grande truite des lacs. Pêche sportive.,🐟,quebecismes
un toutou,плюшевая игрушка,m,"L'enfant dort avec son <b>toutou</b>.","Ребёнок спит со своей <b>плюшевой игрушкой</b>.",Familier. France: peluche / doudou.,🧸,quebecismes
un trappage,охота с капканами,m,"Le <b>trappage</b> est réglementé au Québec.","<b>Охота с капканами</b> регулируется в Квебеке.",Piégeage d'animaux à fourrure. Tradition.,🪤,quebecismes
un traversier,паром,m,"On prend le <b>traversier</b> pour aller à Lévis.","Мы едем на <b>пароме</b> в Леви.",Très courant! France: ferry / bac.,⛴️,quebecismes
une traînerie,разбросанные вещи,f,"Ramasse tes <b>traîneries</b> !","Собери свои <b>разбросанные вещи</b>!",Familier. Objets laissés à la traîne.,🧦,quebecismes
traîneux; traîneuse,копуша,adj,"Tu es trop <b>traîneux</b> on va être en retard !","Ты слишком <b>копаешься</b> — мы опоздаем!",Familier. France: traînard / lent.,🐌,quebecismes
une trempette,соус для макания,f,"J'ai fait une <b>trempette</b> aux épinards.","Я сделал <b>соус</b> со шпинатом для макания.",Sauce pour crudités. France: dip.,🥒,quebecismes
tricoler,шататься (акадийск.),v,"Il <b>tricolait</b> après trois verres de vin.","Он <b>шатался</b> после трёх бокалов вина.",Acadien. France: tituber. Groupe 1 (-er).,🍷,quebecismes
turluter,напевать,v,"Grand-père aime <b>turluter</b> des chansons folkloriques.","Дедушка любит <b>напевать</b> народные песни.",Chant traditionnel québécois. Vocalises sans paroles.,🎵,quebecismes
un téléavertisseur,пейджер,m,"Dans les années 90 tout le monde avait un <b>téléavertisseur</b>.","В 90-х у всех был <b>пейджер</b>.",Terme OQLF. France: pager / bip. Historique.,📟,quebecismes
téteux; téteuse,подлиза,adj,"Il est <b>téteux</b> avec le patron.","Он <b>подлизывается</b> к начальнику.",Familier. France: lèche-bottes / flagorneur.,👅,quebecismes
un urgentologue; une urgentologue,врач скорой помощи,m,"L'<b>urgentologue</b> l'a vu tout de suite.","<b>Врач скорой</b> его сразу осмотрел.",France: urgentiste. Médecin des urgences.,🏥,quebecismes
virailler,крутиться,v,"Les enfants <b>viraillent</b> dans le salon.","Дети <b>крутятся</b> в гостиной.",Familier. Tourner en tous sens. Groupe 1 (-er).,🔄,quebecismes
un vivoir,гостиная,m,"On se retrouve dans le <b>vivoir</b>.","Встретимся в <b>гостиной</b>.",France: salon / salle de séjour. Courant au Québec.,🛋️,quebecismes
vlimeux; vlimeuse,озорной,adj,"Ce petit <b>vlimeux</b> fait des bêtises !","Этот маленький <b>озорник</b> проказничает!",Familier. France: espiègle / coquin.,😈,quebecismes
une zec,охотничья зона,f,"On va chasser dans la <b>zec</b> Batiscan.","Мы едем охотиться в <b>зону</b> Батискан.",Zone d'exploitation contrôlée. Chasse et pêche.,🦌,quebecismes
zigonner,мешкать,v,"Arrête de <b>zigonner</b> avec ta fourchette !","Хватит <b>ковыряться</b> вилкой!",Familier. Hésiter / manipuler. Groupe 1 (-er).,🍴,quebecismes
écartiller,растопыривать,v,"Il <b>écartille</b> les yeux de surprise.","Он <b>вытаращил</b> глаза от удивления.",Familier. France: écarter / écarquiller. Groupe 1 (-er).,👀,quebecismes
écharogner,кромсать,v,"Tu as <b>écharogné</b> le gâteau !","Ты <b>искромсал</b> торт!",Familier. Couper maladroitement. Groupe 1 (-er).,🔪,quebecismes
échiffer,растрёпывать,v,"Le chat a <b>échiffé</b> le coussin.","Кот <b>растрепал</b> подушку.",Familier. France: effilocher. Groupe 1 (-er).,🧶,quebecismes
écourticher,укорачивать,v,"Elle a <b>écourtich</b> sa jupe trop court.","Она <b>укоротила</b> юбку слишком коротко.",Familier. Couper trop court. Groupe 1 (-er).,✂️,quebecismes
écrapoutir,расплющивать,v,"J'ai <b>écrapouti</b> une araignée.","Я <b>расплющил</b> паука.",Familier. France: écraser. Groupe 2 (-ir).,🕷️,quebecismes
épeurant; épeurante,страшный,adj,"Ce film est <b>épeurant</b> !","Этот фильм <b>страшный</b>!",Très courant. France: effrayant. De épeurer.,😱,quebecismes
épeurer,пугать,v,"N'<b>épeure</b> pas le chat !","Не <b>пугай</b> кота!",Très courant. France: effrayer. Groupe 1 (-er).,👻,quebecismes
une épinette,ель,f,"Les <b>épinettes</b> sont couvertes de neige.","<b>Ели</b> покрыты снегом.",Arbre emblématique. France: épicéa. Forêt boréale.,🌲,quebecismes
s'épivarder,дурачиться,v,"Les enfants s'<b>épivardent</b> dans la cour.","Дети <b>дурачатся</b> во дворе.",Familier. S'agiter / faire le fou. Groupe 1 (-er).,🤸,quebecismes
étriver,дразнить,v,"Arrête d'<b>étriver</b> ta sœur !","Хватит <b>дразнить</b> сестру!",Familier. France: taquiner. Groupe 1 (-er).,😜,quebecismes
s'évacher,разваливаться,v,"Il s'est <b>évaché</b> sur le sofa.","Он <b>развалился</b> на диване.",Familier. France: s'affaler / s'avachir. Groupe 1 (-er).,🛋️,quebecismes
abitibien; abitibienne,абитибийский,adj,"La cuisine <b>abitibienne</b> est réconfortante.","<b>Абитибийская</b> кухня согревающая.",De l'Abitibi. Région du Nord-Ouest du Québec.,🗺️,quebecismes
acadien; acadienne,акадийский,adj,"La culture <b>acadienne</b> est riche en musique.","<b>Акадийская</b> культура богата музыкой.",Peuple francophone des Maritimes. Histoire de la déportation.,🦞,quebecismes
une accise,акциз,f,"L'<b>accise</b> sur l'alcool a augmenté.","<b>Акциз</b> на алкоголь вырос.",Impôt indirect. Terme fiscal.,💰,quebecismes
un achigan,чёрный окунь,m,"On a pêché des <b>achigans</b> au lac.","Мы наловили <b>чёрных окуней</b> на озере.",Poisson sportif populaire. France: black-bass.,🐟,quebecismes
un acériculteur; une acéricultrice,производитель кленового сиропа,m,"L'<b>acériculteur</b> récolte l'eau d'érable au printemps.","<b>Производитель сиропа</b> собирает кленовый сок весной.",Métier traditionnel québécois. Temps des sucres.,🍁,quebecismes
agressant; agressante,раздражающий,adj,"Cette musique forte est <b>agressante</b>.","Эта громкая музыка <b>раздражающая</b>.",Familier. France: stressant / agressif.,😤,quebecismes
almatois; almatoise,из Альмы,adj,"La fête <b>almatoise</b> attire des milliers de visiteurs.","<b>Альмовский</b> праздник привлекает тысячи посетителей.",D'Alma. Ville du Saguenay–Lac-Saint-Jean.,📍,quebecismes
amateure,любительница,adj,"Elle est photographe <b>amateure</b>.","Она фотограф-<b>любительница</b>.",Féminin d'amateur. Forme québécoise.,📷,quebecismes
un applet,апплет,m,"Cet <b>applet</b> permet de calculer les taxes.","Этот <b>апплет</b> позволяет рассчитать налоги.",Informatique. Aussi: applette. Petit programme.,💻,quebecismes
une assermentation,присяга,f,"L'<b>assermentation</b> des ministres a eu lieu ce matin.","<b>Присяга</b> министров состоялась этим утром.",Prestation de serment. Terme juridique/politique.,⚖️,quebecismes
une assesseure,заседательница,f,"L'<b>assesseure</b> a participé au jugement.","<b>Заседательница</b> участвовала в суде.",Féminin de assesseur. Terme juridique.,👩‍⚖️,quebecismes
attiner,дразнить (акадийск.),v,"Arrête d'<b>attiner</b> ton cousin !","Хватит <b>дразнить</b> двоюродного брата!",Acadien. France: taquiner. Groupe 1 (-er).,😜,quebecismes
une autocueillette,самосбор,f,"L'<b>autocueillette</b> de pommes ouvre en septembre.","<b>Самосбор</b> яблок открывается в сентябре.",Cueillette par le consommateur. Populaire au Québec.,🍎,quebecismes
avironner,грести,v,"On va <b>avironner</b> sur le lac.","Мы пойдём <b>грести</b> на озере.",France: pagayer / ramer. Groupe 1 (-er).,🚣,quebecismes
un babillard,доска объявлений,m,"J'ai affiché l'annonce sur le <b>babillard</b>.","Я повесил объявление на <b>доску</b>.",France: tableau d'affichage. Courant.,📌,quebecismes
une berçante,кресло-качалка,f,"Grand-père lit dans sa <b>berçante</b>.","Дедушка читает в своём <b>кресле-качалке</b>.",Aussi: chaise berçante. France: fauteuil à bascule.,🪑,quebecismes
un bicycle,велосипед,m,"J'ai appris à faire du <b>bicycle</b> à six ans.","Я научился ездить на <b>велосипеде</b> в шесть лет.",Familier. Anglicisme. France: vélo / bicyclette.,🚲,quebecismes
un blanchon,бельёк (детёныш тюленя),m,"Les <b>blanchons</b> naissent sur la banquise.","<b>Бельки</b> рождаются на льдине.",Petit du phoque. Îles-de-la-Madeleine.,🦭,quebecismes
boisbriannais; boisbriannaise,из Буабриана,adj,"Le festival <b>boisbriannais</b> a lieu en été.","<b>Буабрианский</b> фестиваль проходит летом.",De Boisbriand. Ville de la région de Montréal.,📍,quebecismes
un brayon,тряпка (акадийск.),m,"Passe-moi le <b>brayon</b> pour essuyer la table.","Дай мне <b>тряпку</b> протереть стол.",Acadien. France: chiffon.,🧹,quebecismes
brossardois; brossardoise,из Броссара,adj,"La communauté <b>brossardoise</b> est multiculturelle.","<b>Броссарская</b> община многокультурная.",De Brossard. Ville de la Rive-Sud de Montréal.,📍,quebecismes
un brûlement,жжение,m,"J'ai un <b>brûlement</b> d'estomac.","У меня <b>жжение</b> в желудке.",France: brûlure (sensation). Médical.,🔥,quebecismes
bâsir,прятать (акадийск.),v,"Où as-tu <b>bâsi</b> mes clés ?","Куда ты <b>спрятал</b> мои ключи?",Acadien. Disparaître / cacher. Groupe 2 (-ir).,🔍,quebecismes
une bébite,насекомое,f,"Il y a des <b>bébites</b> dans le jardin.","В саду есть <b>насекомые</b>.",Aussi: bibite bibitte. Variante de bébitte.,🐜,quebecismes
cajun,каджунский,adj,"La musique <b>cajun</b> vient de Louisiane.","<b>Каджунская</b> музыка родом из Луизианы.",Descendants des Acadiens en Louisiane.,🎵,quebecismes
un camelot; une camelot,разносчик газет,m,"Le <b>camelot</b> passe tous les matins.","<b>Разносчик газет</b> приходит каждое утро.",France: livreur de journaux. Métier en voie de disparition.,📰,quebecismes
